{
  "signal_id": "sig-service-capacity-001",
  "version": 1,
  "signal_class": "disruption_signal",
  "metric_type": "regional_heavy_duty_service_capacity",
  "mode": "road",
  "scope": {
    "geography": "US-Gulf-Coast",
    "lane": null,
    "equipment": "class_8",
    "commodity": null
  },
  "effective_at": "2026-08-16T02:00:00Z",
  "observed_at": "2026-08-16T02:00:00Z",
  "valid_until": "2026-08-17T02:00:00Z",
  "freshness": "CURRENT",
  "value": "CONSTRAINED",
  "unit": null,
  "confidence": 0.64,
  "uncertainty": {
    "note": "multi-source regional indicator"
  },
  "sources": [
    {
      "source_id": "partner-service-demo",
      "source_ref": "regional-agg-9",
      "published_at": "2026-08-16T01:55:00Z"
    }
  ],
  "method_version": "service-capacity-v1",
  "rights_policy": "partner-aggregate-demo",
  "disclosure_class": "derived_only",
  "correction_of": null,
  "created_at": "2026-08-16T02:01:00Z"
}
